{"$schema":"https://json-schema.org/draft/2020-12/schema","additionalProperties":false,"properties":{"changes":{"items":{"additionalProperties":false,"properties":{"sourceIds":{"items":{"maxLength":64,"pattern":"^[a-z][a-z0-9-]{0,63}$","type":"string"},"maxItems":8,"minItems":1,"type":"array","uniqueItems":true},"text":{"maxLength":2000,"minLength":1,"type":"string"}},"required":["text","sourceIds"],"type":"object"},"maxItems":16,"minItems":0,"type":"array"},"status":{"enum":["not-drafted","draft"]},"summary":{"maxLength":2000,"minLength":1,"type":"string"},"unknowns":{"items":{"additionalProperties":false,"properties":{"sourceIds":{"items":{"maxLength":64,"pattern":"^[a-z][a-z0-9-]{0,63}$","type":"string"},"maxItems":8,"minItems":1,"type":"array","uniqueItems":true},"text":{"maxLength":2000,"minLength":1,"type":"string"}},"required":["text","sourceIds"],"type":"object"},"maxItems":16,"minItems":0,"type":"array"},"upgradeSteps":{"items":{"additionalProperties":false,"properties":{"sourceIds":{"items":{"maxLength":64,"pattern":"^[a-z][a-z0-9-]{0,63}$","type":"string"},"maxItems":8,"minItems":1,"type":"array","uniqueItems":true},"text":{"maxLength":2000,"minLength":1,"type":"string"}},"required":["text","sourceIds"],"type":"object"},"maxItems":16,"minItems":0,"type":"array"}},"required":["status","summary","changes","upgradeSteps","unknowns"],"type":"object"}