{"status":"draft","summary":"envctl 0.9 changes the default lifetime for newly created environments without an explicit lifetime from 24 hours to 8 hours. Existing environments, including their expiry timestamps, are unchanged.","changes":[{"text":"New environments created without an explicit lifetime default to 8 hours rather than 24 hours.","sourceIds":["pr-lifetime"]},{"text":"Only newly created environments use the new default; no existing environment expiry timestamp is changed.","sourceIds":["pr-lifetime","test-existing"]},{"text":"A newly created environment with an omitted lifetime expires after 8 hours; a simulated 12-hour overnight pipeline lost that environment before its final step as expected expiry behavior.","sourceIds":["test-overnight"]}],"upgradeSteps":[{"text":"Do not rely on the prior 24-hour default for new environments. For overnight or other long pipelines, assess whether an explicit lifetime is needed.","sourceIds":["pr-lifetime","test-overnight"]},{"text":"An explicit lifetime longer than 8 hours requires organisation-policy permission. A 24-hour request is not guaranteed to be allowed; check with the organisation administrator. No universal override or automatic migration is supplied.","sourceIds":["policy-lifetime"]}],"unknowns":[{"text":"The supplied material does not specify CLI syntax for setting an explicit lifetime or exact organisation-policy configuration.","sourceIds":["policy-scope"]},{"text":"Recovery behavior after expiry, production SLOs, and performance benchmarks are not specified.","sourceIds":["policy-scope"]}]}